{
  "$schema": "https://json-schema.org/draft/2020-12/schema",
  "$id": "https://sherpa-ui.dev/schema/page/v1.json",
  "title": "Sherpa-UI page definition",
  "description": "One page, as JSON: its data source and its components' configuration. Its markup is its Context's, in app.v1.json. The provider's open() reads it. docs/PAGE-DEFINITION.md",
  "type": "object",
  "additionalProperties": false,
  "required": ["v", "id"],
  "properties": {
    "$schema": { "type": "string" },
    "v": { "const": 1 },
    "id": {
      "description": "The page's id: its Views, its saved Views and its kept Query are filed under it.",
      "type": "string", "pattern": "^[a-z][a-z0-9-]*$"
    },
    "ui": {
      "description": "Each component's configuration, by id, set through its own API before it is answered — as a View's ui is.",
      "type": "object",
      "additionalProperties": { "type": "object" }
    },
    "source": { "$ref": "#/$defs/source" }
  },
  "$defs": {
    "source": {
      "type": "object",
      "additionalProperties": false,
      "required": ["store"],
      "properties": {
        "store": { "description": "The name the app registered its store under.", "type": "string" },
        "pageSize": { "type": "integer", "minimum": 1 },
        "applyOn": { "description": "change: a filter applies once per act. input: LIVE, while its value moves, debounce ms after the last move. A remote source always waits for Apply.", "enum": ["change", "input"] },
        "debounce": { "description": "How long a live filter waits after the last move, in ms. Default 300.", "type": "integer", "minimum": 0 },
        "holdRows": { "description": "A remote store's whole set is held up to this many rows, and every question is answered from it on the client. 0 holds none. Default 50 000.", "type": "integer", "minimum": 0 },
        "search": { "description": "The fields a free-text search looks at.", "type": "array", "items": { "type": "string" } },
        "fields": {
          "description": "Every field a filter may ask of. No field lists its values: the store's schema says them, or the rows do.",
          "type": "object",
          "additionalProperties": { "$ref": "#/$defs/field" }
        },
        "scopes": {
          "type": "object",
          "additionalProperties": { "$ref": "#/$defs/scope" }
        },
        "presets": {
          "description": "The saved filters the page ships, by id.",
          "type": "object",
          "additionalProperties": { "$ref": "#/$defs/preset" }
        }
      }
    },
    "field": {
      "type": "object",
      "additionalProperties": false,
      "properties": {
        "type": { "enum": ["text", "number", "date"] },
        "label": { "type": "string" },
        "select": { "enum": ["single", "multiple"] },
        "advanced": { "description": "Advanced conditions beside its values (true), or instead of them (\"only\").", "enum": [true, false, "only"] },
        "op": { "description": "The condition its filter opens on.", "type": "string" },
        "min": { "type": "number" },
        "max": { "type": "number" },
        "step": { "type": "number", "exclusiveMinimum": 0 },
        "thresholds": {
          "description": "A number's BANDS, low to high: each one's top, name and status. A gauge's zones, a bar chart's bands and a saved filter's band all read them.",
          "type": "array",
          "items": {
            "type": "object",
            "additionalProperties": false,
            "required": ["to", "label"],
            "properties": {
              "to": { "type": "number" },
              "label": { "type": "string" },
              "status": { "type": "string" }
            }
          }
        },
        "icon": { "type": "string" },
        "labels": {
          "description": "A value's name as a reader sees it, where it is not the value.",
          "type": "object", "additionalProperties": { "type": "string" }
        },
        "carryOver": {
          "description": "Its answer survives a View change that does not answer it; without this, a View resets it.",
          "type": "boolean"
        },
        "child": {
          "description": "The field holding this one's CHILD values — a Customer's Site. A child has no filter of its own: its picks are in this field's reading.",
          "type": "string"
        }
      }
    },
    "scope": {
      "type": "object",
      "additionalProperties": false,
      "properties": {
        "label": { "type": "string" },
        "offers": {
          "description": "Every field it may add, or \"all\" for every field the page declares.",
          "oneOf": [{ "const": "all" }, { "type": "array", "items": { "type": "string" } }]
        },
        "holds": { "description": "The fields it holds at the start.", "type": "array", "items": { "type": "string" } },
        "presets": { "description": "The saved filters its bar shows, each off.", "type": "array", "items": { "type": "string" } },
        "arranges": {
          "description": "Group and Sort arrange its rows: its Organise chips. Left out, a scope over a grid or a list does, and the View does not.",
          "type": "boolean"
        },
        "sets": {
          "description": "Fields drawn as one group. A serial set chains them: each offers only what the answers of the fields above it leave.",
          "type": "array",
          "items": {
            "type": "object",
            "additionalProperties": false,
            "required": ["id", "fields"],
            "properties": {
              "id": { "type": "string" },
              "label": { "type": "string" },
              "mode": { "description": "parallel, the default, only groups them.", "enum": ["serial", "parallel"] },
              "fields": { "description": "In order: in a serial set, the order is the chain.", "type": "array", "items": { "type": "string" }, "minItems": 1 }
            }
          }
        }
      }
    },
    "preset": {
      "type": "object",
      "additionalProperties": false,
      "required": ["where"],
      "properties": {
        "label": { "type": "string" },
        "where": {
          "description": "Its condition, field by field: { \"openTickets\": { \"gt\": 0 } }.",
          "type": "object", "additionalProperties": { "$ref": "#/$defs/condition" }
        }
      }
    },
    "condition": {
      "description": "One field's condition. Several ops all hold; numbers as numbers.",
      "type": "object",
      "additionalProperties": false,
      "minProperties": 1,
      "properties": {
        "eq": {}, "ne": {}, "lt": {}, "lte": {}, "gt": {}, "gte": {},
        "contains": { "type": "string" }, "notcontains": { "type": "string" },
        "startswith": { "type": "string" }, "endswith": { "type": "string" },
        "in": { "type": "array" }, "notin": { "type": "array" },
        "between": { "type": "array", "minItems": 2, "maxItems": 2 },
        "notbetween": { "type": "array", "minItems": 2, "maxItems": 2 },
        "last": { "description": "A date in the last n units, from today.", "type": "number" },
        "next": { "description": "A date in the next n units, from today.", "type": "number" },
        "unit": { "enum": ["day", "week", "month"] },
        "band": { "description": "One of the field's thresholds, by name.", "type": "string" },
        "and": { "type": "array", "items": { "$ref": "#/$defs/condition" } },
        "or": { "type": "array", "items": { "$ref": "#/$defs/condition" } },
        "off": { "description": "Kept, not applied.", "type": "boolean" }
      }
    }
  }
}
